{"constellation_name":"sample_constellation","dependency_graph":[],"generated_at":"2026-07-06T01:13:06.503495+00:00","governance_topology":[],"graph_records":[{"confidence":"medium","evidence":[{"excerpt":"manifest:pyproject.toml","line_number":null,"source_file":"l9-gate-sdk/pyproject.toml","source_type":"file"},{"excerpt":"manifest:pyproject.toml","line_number":null,"source_file":"l9-mcp-server/pyproject.toml","source_type":"file"},{"excerpt":"adr_pattern:adr-001-transport-protocol.md","line_number":null,"source_file":"l9-gate-sdk/docs/adr/adr-001-transport-protocol.md","source_type":"file"}],"id":"repo:sample_constellation","label":"Repository","properties":{"ci_workflows":[],"confidence":"medium","has_adr":true,"has_governance":false,"languages":["Python"],"name":"sample_constellation","owner":"UNKNOWN","package_managers":["uv/pip"],"path":"/home/user/l9-constellation-topology/tests/fixtures/sample_constellation","primary_role":"topology","repo_id":"sample_constellation","secondary_roles":[]},"record_type":"node","source_file":"/home/user/l9-constellation-topology/tests/fixtures/sample_constellation"}],"graphiti_memory_topology":[],"intelligence_flows":[],"maturity_scorecard":[{"band":"nascent","breakdown":{"has_adr":15,"has_ci_workflow":0,"has_dependencies":0,"has_governance":0,"has_package_manifest":0,"has_readme":0,"high_confidence":0},"repo_id":"sample_constellation","score":15}],"neo4j_topology_boundary":[],"repo_inventory":[{"adr_files":["l9-gate-sdk/docs/adr/adr-001-transport-protocol.md"],"ci_workflows":[],"confidence":"medium","downstream_dependents":[],"entrypoints":[],"evidence":[{"excerpt":"manifest:pyproject.toml","line_number":null,"source_file":"l9-gate-sdk/pyproject.toml","source_type":"file"},{"excerpt":"manifest:pyproject.toml","line_number":null,"source_file":"l9-mcp-server/pyproject.toml","source_type":"file"},{"excerpt":"adr_pattern:adr-001-transport-protocol.md","line_number":null,"source_file":"l9-gate-sdk/docs/adr/adr-001-transport-protocol.md","source_type":"file"}],"governance_files":[],"languages":["Python"],"name":"sample_constellation","owner":"UNKNOWN","package_managers":["uv/pip"],"path":"/home/user/l9-constellation-topology/tests/fixtures/sample_constellation","primary_role":"topology","repo_id":"sample_constellation","secondary_roles":[],"upstream_dependencies":[]}],"risk_register":[{"category":"ci_gap","description":"No CI workflow detected in sample_constellation.","evidence":[{"excerpt":"ci_workflows list is empty","line_number":null,"source_file":"/home/user/l9-constellation-topology/tests/fixtures/sample_constellation","source_type":"inference"}],"repo_id":"sample_constellation","risk_id":"sample_constellation:ci_gap","severity":"high"},{"category":"governance_gap","description":"No governance file (CODEOWNERS, OWNERS) found in sample_constellation.","evidence":[{"excerpt":"governance_files list is empty","line_number":null,"source_file":"/home/user/l9-constellation-topology/tests/fixtures/sample_constellation","source_type":"inference"}],"repo_id":"sample_constellation","risk_id":"sample_constellation:governance_gap","severity":"medium"},{"category":"isolation","description":"Repo sample_constellation has no detected dependencies \u2014 possible isolation.","evidence":[{"excerpt":"upstream_dependencies and downstream_dependents are empty","line_number":null,"source_file":"/home/user/l9-constellation-topology/tests/fixtures/sample_constellation","source_type":"inference"}],"repo_id":"sample_constellation","risk_id":"sample_constellation:isolation","severity":"low"}],"runtime_topology":[],"unknowns":[]}